{
  "aggregate_sha256": "c7aa112a2d5c0d3b9184a7abefb140913827af0136163b830bdf329543b3c6af",
  "algorithm": "sha256",
  "contract_version": "1.0.0",
  "files": [
    {
      "path": "docs/evidence/benchmarks/v0.1.0/independent-replay/runs/run-001/audit.json",
      "sha256": "780fb2b856eeaa460db75215d8245e4545af1af796f1463687cd7e280984ddac"
    },
    {
      "path": "docs/evidence/benchmarks/v0.1.0/independent-replay/runs/run-001/final.diff",
      "sha256": "1f1d6aedfa103301521fef1647ea37d8337911ed55ff26e4a20a3fb61b2e9828"
    },
    {
      "path": "docs/evidence/benchmarks/v0.1.0/independent-replay/runs/run-001/green.json",
      "sha256": "db7ab492fd05ea01ca8f9f35f88871f732ebb4e25de14c2b53f13192bd0f8094"
    },
    {
      "path": "docs/evidence/benchmarks/v0.1.0/independent-replay/runs/run-001/install.json",
      "sha256": "ca514a777e5285dfbc50b6a26919235d71991a724fc012efbd706423a42d537c"
    },
    {
      "path": "docs/evidence/benchmarks/v0.1.0/independent-replay/runs/run-001/interrupted.json",
      "sha256": "aa222141f89c36d3115f0d1398fb5c8ccd3487e486f6f8f40a9496cbab011569"
    },
    {
      "path": "docs/evidence/benchmarks/v0.1.0/independent-replay/runs/run-001/red.json",
      "sha256": "d88a49affb0abc47747537802b3efceda0118bd24286aa3177f11b6b75a8cbfa"
    },
    {
      "path": "docs/evidence/benchmarks/v0.1.0/independent-replay/runs/run-001/resumed.json",
      "sha256": "84f9a0ec303d9109ce967c26450e881fc8ca0d24d78eba82e939343275aafc2c"
    },
    {
      "path": "docs/evidence/benchmarks/v0.1.0/independent-replay/runs/run-001/review.json",
      "sha256": "53baea4596ebaaf2478f8dc27aa4a6d3bec7640fa367bd510bac141cc53b4b29"
    },
    {
      "path": "docs/evidence/benchmarks/v0.1.0/independent-replay/runs/run-001/run-report.json",
      "sha256": "442c46ca0aae76fadff7f477fd0828515c35236bc19a07304c4bda4b56300c41"
    },
    {
      "path": "docs/evidence/benchmarks/v0.1.0/independent-replay/runs/run-002/audit.json",
      "sha256": "9e35f9947fe291bd5a6716d6004c806e25c08595c3ddb1715ea92edc5c484241"
    },
    {
      "path": "docs/evidence/benchmarks/v0.1.0/independent-replay/runs/run-002/final.diff",
      "sha256": "e3064562f60c2f5b32cb86564c0fe15aa97d98de9264afdf6a9326473f4b69ca"
    },
    {
      "path": "docs/evidence/benchmarks/v0.1.0/independent-replay/runs/run-002/green.json",
      "sha256": "db7ab492fd05ea01ca8f9f35f88871f732ebb4e25de14c2b53f13192bd0f8094"
    },
    {
      "path": "docs/evidence/benchmarks/v0.1.0/independent-replay/runs/run-002/install.json",
      "sha256": "8fbb9fff6ce6de2cd17bcd5fac67d330b7f02b9fd2a3c271c372ba3b9dd0f0bc"
    },
    {
      "path": "docs/evidence/benchmarks/v0.1.0/independent-replay/runs/run-002/interrupted.json",
      "sha256": "16333abd39b0d93967ac25a1327a014629fc6408408b07facdf1313674dc6fbb"
    },
    {
      "path": "docs/evidence/benchmarks/v0.1.0/independent-replay/runs/run-002/red.json",
      "sha256": "d88a49affb0abc47747537802b3efceda0118bd24286aa3177f11b6b75a8cbfa"
    },
    {
      "path": "docs/evidence/benchmarks/v0.1.0/independent-replay/runs/run-002/resumed.json",
      "sha256": "e9ee7b2548cc065b4d1fb95a65a33f45d9cd32d7a4bc75c9318082dfd80e3327"
    },
    {
      "path": "docs/evidence/benchmarks/v0.1.0/independent-replay/runs/run-002/review.json",
      "sha256": "446cb21ebd8d81890f488d39439752a1784da3655b5c5a9cc5e0bd7b317f25f9"
    },
    {
      "path": "docs/evidence/benchmarks/v0.1.0/independent-replay/runs/run-002/run-report.json",
      "sha256": "8dca597290017c8e7390b91eab9dcc7f12294c3df587207fb438ec1a8fcc450b"
    },
    {
      "path": "docs/evidence/benchmarks/v0.1.0/independent-replay/runs/run-003/audit.json",
      "sha256": "64c7929ac27581cf6bf402c331fa4452dfbe9461d641e54a50b480ead3a52c7b"
    },
    {
      "path": "docs/evidence/benchmarks/v0.1.0/independent-replay/runs/run-003/final.diff",
      "sha256": "01073b17f048aed5adbca0a220569a776be53fc1bab127ad8e1a0081d1214e77"
    },
    {
      "path": "docs/evidence/benchmarks/v0.1.0/independent-replay/runs/run-003/green.json",
      "sha256": "db7ab492fd05ea01ca8f9f35f88871f732ebb4e25de14c2b53f13192bd0f8094"
    },
    {
      "path": "docs/evidence/benchmarks/v0.1.0/independent-replay/runs/run-003/install.json",
      "sha256": "5b6cf10f76a0cce23fb88b44cd0a7c608824fe9de0e9ac402bb0cd6a0de56c91"
    },
    {
      "path": "docs/evidence/benchmarks/v0.1.0/independent-replay/runs/run-003/interrupted.json",
      "sha256": "8fed39cbec387e43fc2c0608878d5d902273eb4d1f66e4f41457b3976fddd658"
    },
    {
      "path": "docs/evidence/benchmarks/v0.1.0/independent-replay/runs/run-003/red.json",
      "sha256": "d88a49affb0abc47747537802b3efceda0118bd24286aa3177f11b6b75a8cbfa"
    },
    {
      "path": "docs/evidence/benchmarks/v0.1.0/independent-replay/runs/run-003/resumed.json",
      "sha256": "cf28843d8e52672f290ab2b165dfba6712a5a8feb837bf988bbbd6a3726ca1aa"
    },
    {
      "path": "docs/evidence/benchmarks/v0.1.0/independent-replay/runs/run-003/review.json",
      "sha256": "e09677adaaef5f529024626e83b8c769a020984567580f61f5ec25a7c309b509"
    },
    {
      "path": "docs/evidence/benchmarks/v0.1.0/independent-replay/runs/run-003/run-report.json",
      "sha256": "237a7a76b0489bacfed443819a291e5c4dede0ee3c867f467d8f7453303f2572"
    },
    {
      "path": "docs/evidence/benchmarks/v0.1.0/runs/run-001/audit.json",
      "sha256": "935a7b3b0fa1237eab8060a1a6d43316cfef95b32ca8893d9e4c78603f88310a"
    },
    {
      "path": "docs/evidence/benchmarks/v0.1.0/runs/run-001/final.diff",
      "sha256": "353ba8eca252481cfd07bc11477e6d519117dc2fe034cb65075faf268946ac6e"
    },
    {
      "path": "docs/evidence/benchmarks/v0.1.0/runs/run-001/green.json",
      "sha256": "db7ab492fd05ea01ca8f9f35f88871f732ebb4e25de14c2b53f13192bd0f8094"
    },
    {
      "path": "docs/evidence/benchmarks/v0.1.0/runs/run-001/install.json",
      "sha256": "cbb1c15f332a4ba91e821a8a00dce39b827398d6b26210cd7184feb8b0a44f05"
    },
    {
      "path": "docs/evidence/benchmarks/v0.1.0/runs/run-001/interrupted.json",
      "sha256": "88f5a3190651a49ee9f94eff21341bd6d8fbd323bf52260743417843018ef995"
    },
    {
      "path": "docs/evidence/benchmarks/v0.1.0/runs/run-001/red.json",
      "sha256": "d88a49affb0abc47747537802b3efceda0118bd24286aa3177f11b6b75a8cbfa"
    },
    {
      "path": "docs/evidence/benchmarks/v0.1.0/runs/run-001/resumed.json",
      "sha256": "a5f942ec5529f82dd0aa079e654b5401808e92a00d56d7b07eac40f62b5e4b0a"
    },
    {
      "path": "docs/evidence/benchmarks/v0.1.0/runs/run-001/review.json",
      "sha256": "2ed2d6878cbbec1cbd1e80b32ca162534882bb622f6042697d732a35b06e5917"
    },
    {
      "path": "docs/evidence/benchmarks/v0.1.0/runs/run-001/run-report.json",
      "sha256": "442c46ca0aae76fadff7f477fd0828515c35236bc19a07304c4bda4b56300c41"
    },
    {
      "path": "docs/evidence/benchmarks/v0.1.0/runs/run-002/audit.json",
      "sha256": "2c7f86d5fcf4a354c0c7a4fe5024627c7a1e7fd8544b2266fa23da4b398aa049"
    },
    {
      "path": "docs/evidence/benchmarks/v0.1.0/runs/run-002/final.diff",
      "sha256": "48faed9da3383acd65e014345b001f4f25b1ef6837641ffeb81fd1a8ffce8fad"
    },
    {
      "path": "docs/evidence/benchmarks/v0.1.0/runs/run-002/green.json",
      "sha256": "db7ab492fd05ea01ca8f9f35f88871f732ebb4e25de14c2b53f13192bd0f8094"
    },
    {
      "path": "docs/evidence/benchmarks/v0.1.0/runs/run-002/install.json",
      "sha256": "4f1d9c1f82d0a2f82a4bbf713e04913b93b45350593ac02f8615e6ee3beb483c"
    },
    {
      "path": "docs/evidence/benchmarks/v0.1.0/runs/run-002/interrupted.json",
      "sha256": "5915d1c600c98f1f5e6e82c60cb4103989b501214760ce090ccdedb26c25cabd"
    },
    {
      "path": "docs/evidence/benchmarks/v0.1.0/runs/run-002/red.json",
      "sha256": "d88a49affb0abc47747537802b3efceda0118bd24286aa3177f11b6b75a8cbfa"
    },
    {
      "path": "docs/evidence/benchmarks/v0.1.0/runs/run-002/resumed.json",
      "sha256": "5b3b13450f1d130f7e1e7668ceafc9b2be1d350a76d0d7e7c625533d2e7c2df9"
    },
    {
      "path": "docs/evidence/benchmarks/v0.1.0/runs/run-002/review.json",
      "sha256": "6c882aeb287fafa01183de0c0666ca841f3ea3580545c87f21f208f7b2ca83bc"
    },
    {
      "path": "docs/evidence/benchmarks/v0.1.0/runs/run-002/run-report.json",
      "sha256": "8dca597290017c8e7390b91eab9dcc7f12294c3df587207fb438ec1a8fcc450b"
    },
    {
      "path": "docs/evidence/benchmarks/v0.1.0/runs/run-003/audit.json",
      "sha256": "d94aef4ec5ead502a0c3c79f7ebf546cbc8d2438409dc7c3c5671e055deeae44"
    },
    {
      "path": "docs/evidence/benchmarks/v0.1.0/runs/run-003/final.diff",
      "sha256": "c10c797364ce8c468ec28a34bcbe6c4f71bbbecb04f7a0565e9b003c1e90564b"
    },
    {
      "path": "docs/evidence/benchmarks/v0.1.0/runs/run-003/green.json",
      "sha256": "db7ab492fd05ea01ca8f9f35f88871f732ebb4e25de14c2b53f13192bd0f8094"
    },
    {
      "path": "docs/evidence/benchmarks/v0.1.0/runs/run-003/install.json",
      "sha256": "e7b7b7eae3aca59132a6f6e9be5307af6df4e1d95e02ae89fa2aba83701d223f"
    },
    {
      "path": "docs/evidence/benchmarks/v0.1.0/runs/run-003/interrupted.json",
      "sha256": "d20240e67f4dfebce258189002bce05f05f06e8c38cfb7ba732559599d07c209"
    },
    {
      "path": "docs/evidence/benchmarks/v0.1.0/runs/run-003/red.json",
      "sha256": "d88a49affb0abc47747537802b3efceda0118bd24286aa3177f11b6b75a8cbfa"
    },
    {
      "path": "docs/evidence/benchmarks/v0.1.0/runs/run-003/resumed.json",
      "sha256": "57399fa7a90104b7de1c185813690fb76b9e8d789e41196f3a29f423f05878cd"
    },
    {
      "path": "docs/evidence/benchmarks/v0.1.0/runs/run-003/review.json",
      "sha256": "47f1054a31b71dc81361437273d235acb3d335abf5819963fccf606dc917b84c"
    },
    {
      "path": "docs/evidence/benchmarks/v0.1.0/runs/run-003/run-report.json",
      "sha256": "237a7a76b0489bacfed443819a291e5c4dede0ee3c867f467d8f7453303f2572"
    }
  ]
}
